{
  "_comment": "Generated by version-service/generate-channel.sh from branding/identity.env. Validate against the pinned Supervisor before publishing (version-service/README.md). Publish to the esaueng/FactoryAssistantOS GitHub Pages site; OTA bundles ride that repo's GitHub Releases. Bootstrap beta mirrors the current component set until a separately promoted beta component set is cut.",
  "channel": "beta",
  "supervisor": "2026.6.0",
  "homeassistant": {
    "default": "2026.6.0"
  },
  "hassos": {
    "ota": "https://github.com/esaueng/FactoryAssistantOS/releases/download/{version}/faos_{board}-{version}.raucb",
    "generic-x86-64": "17.3",
    "qemux86-64": "17.3"
  },
  "dns": "2026.6.0",
  "audio": "2026.6.0",
  "cli": "2026.6.0",
  "multicast": "2026.6.0",
  "observer": "2026.6.0",
  "images": {
    "core": "ghcr.io/esaueng/{machine}-homeassistant",
    "supervisor": "ghcr.io/esaueng/{arch}-hassio-supervisor",
    "cli": "ghcr.io/esaueng/{arch}-hassio-cli",
    "dns": "ghcr.io/esaueng/{arch}-hassio-dns",
    "audio": "ghcr.io/esaueng/{arch}-hassio-audio",
    "observer": "ghcr.io/esaueng/{arch}-hassio-observer",
    "multicast": "ghcr.io/esaueng/{arch}-hassio-multicast"
  }
}
